{
  "schema_version": 1,
  "record_type": "pinned-composition-result",
  "baseline_sha256": "aaaaaaaaaaaaaaaaaaaaaaaaaaaaaaaaaaaaaaaaaaaaaaaaaaaaaaaaaaaaaaaa",
  "rpm_snapshot_sha256": "bbbbbbbbbbbbbbbbbbbbbbbbbbbbbbbbbbbbbbbbbbbbbbbbbbbbbbbbbbbbbbbb",
  "packages": [
    {
      "name": "fedora-release",
      "nevra": "fedora-release-0:1-1.fc44.x86_64",
      "sha256": "cccccccccccccccccccccccccccccccccccccccccccccccccccccccccccccccc"
    },
    {
      "name": "kernel-quirkbench",
      "nevra": "kernel-quirkbench-0:1-1.fc44.x86_64",
      "sha256": "cccccccccccccccccccccccccccccccccccccccccccccccccccccccccccccccc"
    },
    {
      "name": "quirkbench-experiment-userspace",
      "nevra": "quirkbench-experiment-userspace-0:1-1.fc44.x86_64",
      "sha256": "cccccccccccccccccccccccccccccccccccccccccccccccccccccccccccccccc"
    }
  ],
  "target_recipes": [
    {
      "recipe_id": "system-observation",
      "digest": "dddddddddddddddddddddddddddddddddddddddddddddddddddddddddddddddd"
    }
  ]
}
